<?xml version="1.0" encoding="UTF-8"?>
<!ELEMENT breakfast (food+)>
<!ELEMENT food (name, price, description, calories)>
<!ELEMENT name (#PCDATA)>
<!ELEMENT price (#PCDATA)>
<!ELEMENT description (#PCDATA)>
<!ELEMENT calories (#PCDATA)>